ID,Disease Domain,News Title,News Snippet,Source Domain,Label
MH001,COVID-19,New Omicron subvariant XBB.1.5 shows increased transmissibility,"WHO reports that XBB.1.5 is the most transmissible subvariant to date, but current vaccines still offer protection against severe disease.",who.int,Real
MH002,Ebola,Uganda declares end of Ebola outbreak after 142 confirmed cases,"The outbreak, caused by the Sudan ebolavirus, ended with no new cases reported for 42 days.",cdc.gov,Real
MH003,Zika,"Zika virus transmission persists in parts of the Americas, PAHO warns",PAHO urges pregnant women to avoid travel to areas with active Zika transmission due to risk of microcephaly.,paho.org,Real
MH004,SARS,Study finds SARS-CoV-2 antibodies wane faster than SARS-CoV-1 antibodies,"Researchers compare long-term immunity between the two coronaviruses, highlighting need for booster shots.",nature.com,Real
MH005,Cancer,Immunotherapy shows 40% tumor reduction in advanced melanoma trial,New combination therapy (nivolumab + relatlimab) improves progression-free survival in phase 3 trial.,cancer.gov,Real
MH006,HIV/AIDS,Long-acting injectable cabotegravir reduces HIV infection risk by 89%,The HPTN 084 trial shows superior efficacy compared to daily oral PrEP in cisgender women.,hiv.gov,Real
MH007,Polio,Pakistan reports first polio case of 2026 in Khyber Pakhtunkhwa,"Environmental samples confirm wild poliovirus type 1, vaccination campaigns intensified.",polioeradication.org,Real
MH008,Infectious Disease,CDC issues alert over drug-resistant Shigella infections in the US,Shigella strains with extended-spectrum beta-lactamase genes are spreading among men who have sex with men.,cdc.gov,Real
MH009,Rheumatology,New ACR guidelines recommend JAK inhibitors for refractory rheumatoid arthritis,The update includes risk mitigation strategies for cardiovascular events and malignancies.,rheumatology.org,Real
MH010,Hematology,Gene therapy for sickle cell disease receives FDA breakthrough designation,Exa-cel (CRISPR-based) shows 95% reduction in vaso-occlusive crises in ongoing trials.,fda.gov,Real
MH011,Urology,AI-assisted MRI improves prostate cancer detection rate by 32%,A multi-center study shows that AI reduces unnecessary biopsies and detects clinically significant cancers.,euoncology.eu,Real
MH012,Allergy,Omalizumab shows promise in treating multiple food allergies simultaneously,"NIH-funded study finds that anti-IgE therapy increases tolerance to peanuts, eggs, and milk.",nih.gov,Real
MH013,Genetics,CRISPR-Cas9 corrects Duchenne muscular dystrophy mutation in human embryos,Researchers from Oregon Health & Science University report successful repair of dystrophin gene.,ohsu.edu,Real
MH014,Dentistry,"Silver diamine fluoride effectively halts caries in primary teeth, study finds",Low-cost intervention reduces tooth decay progression by 75% in underserved preschool children.,jada.ada.org,Real
MH015,Sports Medicine,Concussion recovery time shorter with active rehabilitation protocol,New trial shows that early sub-threshold aerobic exercise speeds return-to-play by 10 days.,bjsm.bmj.com,Real
MH016,Geriatrics,Multidomain intervention reduces frailty and falls in older adults by 30%,"The SPRINTT trial combines physical activity, nutrition, and cognitive training.",jamanetwork.com,Real
MH017,Sleep Medicine,Cognitive behavioral therapy for insomnia (CBT-I) outperforms sedatives long-term,5-year follow-up shows CBT-I maintains sleep efficiency improvements without dependency.,sleepfoundation.org,Real
MH018,Obesity,Semaglutide 2.4 mg leads to 15% weight loss in adolescents with obesity,STEP TEENS trial shows significant BMI reduction and improved cardiometabolic parameters.,nejm.org,Real
MH019,Kidney Disease,SGLT2 inhibitors slow GFR decline in chronic kidney disease regardless of diabetes,DAPA-CKD trial extended analysis confirms benefit in non-diabetic CKD patients.,thelancet.com,Real
MH020,Stroke,Tenecteplase shows non-inferiority to alteplase in acute ischemic stroke,EXTEND-IA TNK trial finds faster administration and similar safety profile.,strokejournal.org,Real
MH021,Asthma,Biologic dupilumab reduces severe asthma exacerbations by 50% in children,VOYAGE trial shows improvement in lung function and quality of life in 6–11 year olds.,nejm.org,Real
MH022,Tuberculosis,Shorter 4-month regimen for drug-sensitive TB shows high cure rates,The TRUNCATE-TB trial finds that a 4-month regimen with rifapentine and moxifloxacin is non-inferior.,who.int,Real
MH023,Hepatitis,WHO launches global strategy to eliminate hepatitis B and C by 2030,New targets include 90% reduction in new infections and 65% reduction in mortality.,who.int,Real
MH024,Arthritis,Methotrexate plus TNF inhibitor yields better outcomes in psoriatic arthritis,Two-year data from the EXCEED trial shows sustained remission rates.,arthritis.org,Real
MH025,Osteoporosis,Romosozumab reduces vertebral fractures by 73% in postmenopausal women,ARCH study extension shows sustained bone density gains and fracture risk reduction.,jbmr.org,Real
MH026,Pediatrics,RSV vaccine (Abrysvo) approved for use during pregnancy to protect infants,FDA approval based on MATISSE trial showing 81% efficacy against severe RSV in first 3 months.,fda.gov,Real
MH027,Infectious Disease,"Nipah virus outbreak in Kerala, India: 2 deaths, contact tracing underway",Health officials monitor high-risk contacts and test fruit bat samples for reservoir.,cdc.gov,Real
MH028,Rheumatology,Guselkumab improves enthesitis and dactylitis in psoriatic arthritis,Phase 3 DISCOVER-2 trial demonstrates sustained efficacy through 2 years.,rheumatology.org,Real
MH029,Hematology,Hemophilia A gene therapy shows 5-year durability in phase 1/2 trial,Valoctocogene roxaparvovec maintains Factor VIII levels with reduced bleeding episodes.,bloodjournal.org,Real
MH030,Urology,MRI-targeted biopsy reduces overdiagnosis of low-risk prostate cancer,PRECISION trial confirms targeted approach detects more clinically significant cancers.,euoncology.eu,Real
MH031,Allergy,Peanut oral immunotherapy (AR101) receives European approval for children,Palforzia now authorized for desensitization in 4–17 year olds with confirmed peanut allergy.,ema.europa.eu,Real
MH032,Genetics,Whole-genome sequencing identifies novel variants for familial hypercholesterolemia,Study in Nature Genetics reveals new LDLR and APOB mutations.,nature.com,Real
MH033,Dentistry,"Periodontal disease linked to higher risk of Alzheimer’s, longitudinal study",Porphyromonas gingivalis antibodies found in CSF of dementia patients.,jdr.iadr.org,Real
MH034,Sports Medicine,ACL reconstruction with quadriceps tendon shows better outcomes than hamstring,5-year follow-up shows lower graft failure and higher patient-reported knee function.,ajsm.sagepub.com,Real
MH035,Geriatrics,Home-based physical therapy reduces hospital readmissions in frail elders,Randomized trial shows 28% reduction in 30-day readmission rates.,jagsjournal.com,Real
MH036,Sleep Medicine,"Blue-light filtering glasses do not improve sleep quality, new meta-analysis finds",Systematic review of 13 trials shows negligible effect on total sleep time or latency.,sleepjournal.org,Real
MH037,Obesity,Bariatric surgery lowers cancer risk in women with obesity by 42%,Retrospective cohort study from Swedish Obese Subjects (SOS) database.,obesityjournal.org,Real
MH038,Kidney Disease,"Finerenone reduces cardiovascular events in CKD with T2D, FIDELITY analysis",Pooled data from FIDELIO-DKD and FIGARO-DKD shows consistent benefit.,nejm.org,Real
MH039,Stroke,Mechanical thrombectomy benefits extended to large infarct core patients,SELECT2 trial shows improved functional outcomes vs medical management alone.,strokejournal.org,Real
MH040,Asthma,Inhaled corticosteroids plus LABA reduce exacerbations in mild asthma,SMART trial shows as-needed combination therapy is superior to SABA alone.,nejm.org,Real
MH041,Tuberculosis,New urine-based LAM test detects TB in HIV-positive patients with high specificity,FujiLAM assay shows 85% sensitivity in CD4 <100 cells/µL.,who.int,Real
MH042,Hepatitis,Sofosbuvir/velpatasvir cures HCV in 98% of patients with compensated cirrhosis,"Real-world data from 10,000 patients in the HepNet registry.",hepatologyjournal.org,Real
MH043,Arthritis,"Tofacitinib shows comparable efficacy to adalimumab in RA, safety profile similar",ORAL Strategy trial 1-year data with cardiovascular risk stratification.,arthritis-research.com,Real
MH044,Osteoporosis,Zoledronic acid reduces hip fracture risk by 40% in elderly women,HORIZON-PFT extension trial over 6 years.,jbmr.org,Real
MH045,Pediatrics,High-dose flu vaccine provides better protection in children with asthma,FLUAVAS trial shows 30% fewer hospitalizations during influenza season.,pediatrics.aappublications.org,Real
MH046,COVID-19,Intranasal vaccine (BBV154) shows robust mucosal immunity in phase 2 trial,India's Bharat Biotech reports durable IgA responses and neutralization against variants.,who.int,Real
MH047,Ebola,rVSV-ZEBOV vaccine protects against Ebola for at least 5 years,Follow-up of PREVAIL study in Sierra Leone shows persistent antibodies.,nejm.org,Real
MH048,Zika,"Zika virus infection in pregnant women linked to placental damage, study",Histopathological findings show chronic villitis and trophoblast necrosis.,plosntds.org,Real
MH049,SARS,Remdesivir shows in vitro activity against SARS-CoV-2 but not SARS-CoV-1,Comparative study highlights differences in RNA polymerase binding.,nature.com,Real
MH050,Cancer,Personalized mRNA vaccine (mRNA-4157) plus pembrolizumab reduces melanoma recurrence,Phase 2b KEYNOTE-942 trial shows 44% reduction in distant metastasis.,cancer.gov,Real
MH051,HIV/AIDS,Weekly oral islatravir shows durable suppression in phase 2 HIV trial,New nucleoside reverse transcriptase translocation inhibitor maintains viral load <50 copies/mL.,hiv.gov,Real
MH052,Polio,CDC reports vaccine-derived polio case in New York wastewater,Environmental surveillance detects type 2 Sabin strain with neurovirulence reversion.,cdc.gov,Real
MH053,Infectious Disease,Melioidosis cases rise in northern Australia after heavy flooding,CDC warns of Burkholderia pseudomallei in soil and water; high mortality if untreated.,cdc.gov,Real
MH054,Rheumatology,IL-6 inhibitor sarilumab improves fatigue and pain in polymyalgia rheumatica,Phase 3 SAPHYR trial shows rapid response and steroid-sparing effect.,rheumatology.org,Real
MH055,Hematology,Eltrombopag plus ATG improves severe aplastic anemia response rates,"RACE trial shows 82% overall response at 6 months, especially in younger patients.",bloodjournal.org,Real
MH056,Urology,Low-intensity shockwave therapy improves erectile function in diabetic men,12-week RCT shows significant IIEF-EF score improvement without adverse events.,euoncology.eu,Real
MH057,Allergy,Sublingual house dust mite immunotherapy reduces asthma exacerbations,MITRA trial shows 35% reduction in moderate/severe exacerbations in children.,jaci.org,Real
MH058,Genetics,New gene editing tool (prime editing) corrects cystic fibrosis mutation in organoids,Prime editing achieves 90% correction of F508del in patient-derived intestinal organoids.,nature.com,Real
MH059,Dentistry,Fluoride varnish every 6 months reduces caries in high-risk adults,Community-based study shows 27% reduction in root caries over 2 years.,jada.ada.org,Real
MH060,Sports Medicine,Platelet-rich plasma injection does not improve Achilles tendinopathy outcomes,Double-blind RCT shows no difference vs saline placebo at 6 months.,bjsm.bmj.com,Real
MH061,Geriatrics,Vitamin D plus calcium does not reduce fall risk in community-dwelling elders,US Preventive Services Task Force update confirms insufficient evidence.,jamanetwork.com,Real
MH062,Sleep Medicine,Digital CBT-I app (Sleepio) receives FDA authorization for chronic insomnia,Prescription-only digital therapeutic shows efficacy in 6-week randomized trial.,fda.gov,Real
MH063,Obesity,"Tirzepatide surpasses semaglutide in weight loss, SURMOUNT-5 trial",GIP/GLP-1 dual agonist shows 22% body weight reduction at 72 weeks.,nejm.org,Real
MH064,Kidney Disease,Empagliflozin reduces acute kidney injury risk in hospitalized patients,EMPA-KIDNEY subgroup analysis shows 28% lower AKI events in CKD patients.,thelancet.com,Real
MH065,Stroke,Intensive blood pressure lowering after thrombectomy improves functional outcomes,ENCHANTED2/MT trial shows target SBP 120–140 mmHg optimal.,strokejournal.org,Real
MH066,Asthma,Tezepelumab reduces exacerbations across all eosinophil levels,NAVIGATOR trial shows benefit even in low-eosinophil phenotype.,nejm.org,Real
MH067,Tuberculosis,Bedaquiline-pretomanid-linezolid regimen cures 90% of drug-resistant TB,ZeNix trial shows 6-month regimen with minimal toxicity.,who.int,Real
MH068,Hepatitis,HBV reactivation risk higher with rituximab than TNF inhibitors in RA patients,Systematic review of 42 studies shows 12% vs 3% reactivation.,hepatologyjournal.org,Real
MH069,Arthritis,Baricitinib improves hand function and pain in erosive hand osteoarthritis,Phase 2 trial shows 40% pain reduction on VAS scale.,arthritis-research.com,Real
MH070,Osteoporosis,Abaloparatide shows superior cortical bone gain vs teriparatide,High-resolution peripheral QCT study shows 15% higher cortical thickness.,jbmr.org,Real
MH071,Pediatrics,Early peanut introduction reduces peanut allergy by 71% in high-risk infants,LEAP-Trio trial follow-up at age 12 shows sustained tolerance.,pediatrics.aappublications.org,Real
MH072,COVID-19,COVID-19 vaccination reduces long COVID risk by 50% in breakthrough infections,Large UK Biobank study shows protective effect even after infection.,who.int,Real
MH073,Ebola,Rapid diagnostic test (ReEBOV) shows 98% sensitivity in field settings,Evaluation in DRC outbreak shows good performance at 30°C ambient temperature.,cdc.gov,Real
MH074,Zika,"Zika virus can persist in adult brain, causing long-term neurological deficits",Mouse study shows hippocampal damage and cognitive impairment months after infection.,plosntds.org,Real
MH075,SARS,Structural analysis reveals SARS-CoV-2 spike stability higher than SARS-CoV-1,Cryo-EM shows more compact prefusion conformation.,nature.com,Real
MH076,Cancer,PARP inhibitor olaparib extends progression-free survival in BRCA-mutated pancreatic cancer,POLO trial 5-year update shows durable benefit in metastatic disease.,cancer.gov,Real
MH077,HIV/AIDS,Injectable lenacapavir given twice-yearly shows 100% HIV prevention efficacy,PURPOSE 1 trial in young African women shows zero infections.,hiv.gov,Real
MH078,Polio,GPEI launches new oral vaccine (nOPV2) to combat circulating vaccine-derived polio,Genetically stabilized vaccine reduces risk of reversion.,polioeradication.org,Real
MH079,Infectious Disease,"Candida auris outbreak in US healthcare facilities, CDC issues containment alert",Multidrug-resistant fungus spreads via contaminated skin and environmental surfaces.,cdc.gov,Real
MH080,Rheumatology,Upadacitinib shows sustained remission in ankylosing spondylitis at 52 weeks,SELECT-AXIS 2 trial with low radiographic progression.,rheumatology.org,Real
MH081,Hematology,Betibeglogene autotemcel (Zynteglo) shows durable transfusion independence in beta-thalassemia,Long-term follow-up shows 90% patients off transfusion for >5 years.,bloodjournal.org,Real
MH082,Urology,Combination tadalafil + finasteride reduces BPH symptom score by 10 points,2-year RCT shows superior outcomes vs monotherapy.,euoncology.eu,Real
MH083,Allergy,Food allergy desensitization using omalizumab achieves 60% higher tolerance,Multi-center trial shows rapid escalation with fewer adverse events.,jaci.org,Real
MH084,Genetics,Antisense oligonucleotide (tominersen) slows Huntington’s disease progression,Phase 2 trial shows 35% slower decline in composite motor score.,nature.com,Real
MH085,Dentistry,"Smart toothbrush with AI detects early enamel erosion, study shows",Integrated pH and force sensors provide real-time feedback.,jada.ada.org,Real
MH086,Sports Medicine,Blood flow restriction training improves muscle strength in ACL rehabilitation,Systematic review shows 25% greater quadriceps gain vs standard PT.,bjsm.bmj.com,Real
MH087,Geriatrics,Hearing aids reduce cognitive decline by 48% in older adults with hearing loss,ACHIEVE trial shows 3-year follow-up benefit in executive function.,jamanetwork.com,Real
MH088,Sleep Medicine,Suvorexant improves sleep maintenance but not sleep onset in elderly insomnia,DORA receptor antagonist shows 30% reduction in WASO.,sleepfoundation.org,Real
MH089,Obesity,Setmelanotide (MC4R agonist) reduces hunger and weight in Bardet-Biedl syndrome,Phase 3 trial shows 18% BMI reduction in rare genetic obesity.,obesityjournal.org,Real
MH090,Kidney Disease,Canagliflozin reduces albuminuria progression in CKD without diabetes,CREDENCE extension shows renoprotection independent of glycemic effect.,thelancet.com,Real
MH091,Stroke,CT perfusion imaging guides late-window thrombectomy up to 24 hours,DAWN trial extended analysis shows benefit in select patients.,strokejournal.org,Real
MH092,Asthma,Mepolizumab reduces emergency visits in severe eosinophilic asthma,Real-world UK registry shows 60% reduction in A&E attendances.,nejm.org,Real
MH093,Tuberculosis,GeneXpert MTB/RIF Ultra improves detection of paucibacillary TB in children,High sensitivity (88%) vs culture in pediatric stool samples.,who.int,Real
MH094,Hepatitis,Glecaprevir/pibrentasvir cures HCV in genotype 3 with cirrhosis in 8 weeks,ENDURANCE-3 trial shows 97% SVR12.,hepatologyjournal.org,Real
MH095,Arthritis,"Abatacept plus methotrexate slows joint damage in early RA, 2-year data",AVERT-2 trial shows 60% fewer erosions vs methotrexate alone.,arthritis-research.com,Real
MH096,Osteoporosis,Denosumab reduces vertebral fracture risk by 68% in men with osteoporosis,FREEDOM extension in men shows similar efficacy as women.,jbmr.org,Real
MH097,Pediatrics,Palivizumab reduces RSV hospitalization in preterm infants by 55%,10-year retrospective cohort study.,pediatrics.aappublications.org,Real
MH098,COVID-19,Paxlovid reduces hospitalization risk by 89% in unvaccinated high-risk adults,EPIC-HR trial final analysis confirms efficacy in Omicron era.,who.int,Real
MH099,Ebola,Antibody mAb114 (Ansuvimab) shows 90% survival in Ebola virus disease,PALM trial follow-up shows durable protection.,cdc.gov,Real
MH100,Zika,"Zika virus linked to Guillain-Barré syndrome in older adults, case series",12 patients in Puerto Rico reported with acute demyelinating neuropathy.,plosntds.org,Real
MH101,SARS,Middle East respiratory syndrome (MERS) case imported to UK from UAE,Public health authorities initiate contact tracing; patient isolated in London hospital.,gov.uk,Real
MH102,Cancer,Trastuzumab deruxtecan shows 45% response rate in HER2-low metastatic breast cancer,DESTINY-Breast04 trial expands treatment options beyond HER2-positive.,cancer.gov,Real
MH103,HIV/AIDS,Dovato (DTG/3TC) maintains virologic suppression in switch study at 144 weeks,TANGO trial shows non-inferiority to TAF-based regimens with better bone safety.,hiv.gov,Real
MH104,Polio,Malawi launches emergency vaccination campaign after wild polio case detected,First case in Africa in 5 years; 4 million children targeted for vaccination.,polioeradication.org,Real
MH105,Infectious Disease,Leptospirosis cases surge in Philippines after typhoon flooding,DOH reports 500+ cases; IV antibiotics and doxycycline prophylaxis recommended.,cdc.gov,Real
MH106,Rheumatology,Ixekizumab improves nail and skin psoriasis in patients with psoriatic arthritis,SPIRIT-P1 trial shows 80% PASI 75 at week 24.,rheumatology.org,Real
MH107,Hematology,Lusutrombopag reduces need for platelet transfusions in chronic liver disease,Phase 3 study shows 78% responders within 7 days.,bloodjournal.org,Real
MH108,Urology,Urolift system shows 5-year durability in benign prostatic hyperplasia,LIFT study shows sustained IPSS improvement and low retreatment rate.,euoncology.eu,Real
MH109,Allergy,Ragweed sublingual immunotherapy (SLIT) tablet reduces nasal symptoms by 40%,Real-world study from 1500 patients confirms long-term efficacy.,jaci.org,Real
MH110,Genetics,Gene therapy for Leber congenital amaurosis (LCA) restores vision in children,Spark Therapeutics reports 3-year follow-up with functional vision gain.,nature.com,Real
MH111,Dentistry,Photodynamic therapy reduces peri-implantitis biofilm by 95% in vitro,Methylene blue + 660nm laser shows potent anti-biofilm effect.,jada.ada.org,Real
MH112,Sports Medicine,Neuromuscular warm-up program reduces hamstring strain by 50% in soccer players,Nordic hamstring exercises plus core stability in 3000 players.,bjsm.bmj.com,Real
MH113,Geriatrics,Annual comprehensive geriatric assessment reduces unplanned admissions by 20%,Cluster RCT in UK primary care shows cost-effectiveness.,jamanetwork.com,Real
MH114,Sleep Medicine,Trazodone improves sleep quality in Alzheimer's patients without cognitive decline,8-week trial shows 30% reduction in wake after sleep onset.,sleepfoundation.org,Real
MH115,Obesity,Orlistat plus lifestyle intervention produces 8% weight loss in adolescents,1-year trial shows improvement in insulin sensitivity and lipid profile.,obesityjournal.org,Real
MH116,Kidney Disease,Dapagliflozin reduces proteinuria by 35% in IgA nephropathy,DAPA-IGAN trial shows renoprotection independent of blood pressure.,thelancet.com,Real
MH117,Stroke,Mobile stroke unit (MSU) reduces time to thrombolysis by 25 minutes,Urban study shows improved outcomes in ischemic stroke patients.,strokejournal.org,Real
MH118,Asthma,Fluticasone furoate/umeclidinium/vilanterol reduces exacerbations in COPD-asthma overlap,52-week trial shows 35% reduction in moderate/severe events.,nejm.org,Real
MH119,Tuberculosis,New pediatric TB formulation (dispersible) improves adherence in rural Africa,4-drug fixed-dose combination with fruit flavor shows 95% adherence.,who.int,Real
MH120,Hepatitis,Tenofovir alafenamide (TAF) shows better renal safety than tenofovir disoproxil in HBV,5-year data from 900 patients shows lower renal tubular dysfunction.,hepatologyjournal.org,Real
MH121,Arthritis,Synovial fluid biomarker (sCD14) predicts early response to TNF inhibitors in RA,Multi-center study shows 80% predictive accuracy at 3 months.,arthritis-research.com,Real
MH122,Osteoporosis,Teriparatide plus denosumab shows additive effect on bone density in postmenopausal women,2-year RCT shows 12% greater BMD gain vs monotherapy.,jbmr.org,Real
MH123,Pediatrics,Hypothermia for neonatal encephalopathy improves survival without disability at 6 years,Whole-body cooling reduces death/disability from 40% to 25%.,pediatrics.aappublications.org,Real
MH124,COVID-19,Novavax's protein-based vaccine (NVX-CoV2373) shows 92% efficacy against variants,UK/US trials demonstrate broad neutralization against Omicron subvariants.,who.int,Real
MH125,Ebola,Ebola survivor plasma shows cross-neutralization against multiple ebolaviruses,Broad-spectrum antibodies identified for therapeutic development.,cdc.gov,Real
MH126,Zika,"Zika virus damages testicular tissue in mice, raising fertility concerns","Viral RNA found in Sertoli cells, causing apoptosis and decreased sperm count.",plosntds.org,Real
MH127,SARS,"COVID-19 pandemic delays TB diagnosis by 30%, WHO estimates","Disruption in healthcare access leads to 500,000 additional TB deaths globally.",who.int,Real
MH128,Cancer,Sotorasib (KRAS G12C) plus panitumumab improves PFS in colorectal cancer,CodeBreaK 300 trial shows 6-month PFS vs 2-month for control.,cancer.gov,Real
MH129,HIV/AIDS,Broadly neutralizing antibodies (bNAbs) show 80% HIV suppression in humanized mice,Combination of 3 bNAbs prevents viral escape better than monotherapy.,hiv.gov,Real
MH130,Polio,Nigeria successfully switches to bivalent OPV to reduce vaccine-derived cases,Strategic transition aligns with GPEI roadmap.,polioeradication.org,Real
MH131,Infectious Disease,"Cholera outbreak in Syria: 10,000+ suspected cases, WHO deploys rapid response teams",Oral cholera vaccination campaign launched in high-risk governorates.,who.int,Real
MH132,Rheumatology,Tofacitinib plus methotrexate reduces radiographic progression in early RA,ORAL Start trial shows 60% less joint erosion at 2 years.,rheumatology.org,Real
MH133,Hematology,Crizanlizumab reduces painful crises in sickle cell disease by 45%,SUSTAIN trial follow-up shows durable benefit over 52 weeks.,bloodjournal.org,Real
MH134,Urology,Robotic pyeloplasty shows 95% success rate in ureteropelvic junction obstruction,5-year data from 1000+ patients with low complication rate.,euoncology.eu,Real
MH135,Allergy,Grass pollen SLIT tablet reduces seasonal allergy symptoms and rescue medication use,5-year real-world effectiveness study in 2000 patients.,jaci.org,Real
MH136,Genetics,Base editing corrects Tay-Sachs disease mutation in human neurons,First ex-vivo correction with delivery via AAV9 vector.,nature.com,Real
MH137,Dentistry,Salivary microRNA panel detects oral squamous cell carcinoma with 85% sensitivity,Non-invasive diagnostic tool shows promise for early detection.,jada.ada.org,Real
MH138,Sports Medicine,Eccentric training vs surgery for Achilles rupture: similar outcomes at 12 months,RCT shows early mobilization gives comparable functional results.,bjsm.bmj.com,Real
MH139,Geriatrics,Cognitive stimulation therapy improves memory and quality of life in mild dementia,UK-based trial shows 2-year benefit over standard care.,jamanetwork.com,Real
MH140,Sleep Medicine,Zolpidem (Ambien) withdrawal linked to rebound insomnia and anxiety in elderly,Case series shows 60% relapse rate after discontinuation.,sleepfoundation.org,Real
MH141,Obesity,Weight-adjusted dosing of semaglutide improves outcomes in Asian populations,Subgroup analysis of STEP trials shows similar efficacy at lower BMI.,obesityjournal.org,Real
