ID,Disease Domain,News Title,News Snippet,Source Domain,Label
RHR015,Allergy,Allergic diseases signal public health crisis requiring global allergy health plan,"Allergic conditions represent a public health crisis never seen before, with heavily environment-dependent symptoms including food, pollen and animal triggers.",pmc.ncbi.nlm.nih.gov,Real
RHR016,Allergy,Skin scratching in allergic inflammation may paradoxically protect from infection,Researchers found how scratching can worsen allergic skin symptoms but also protect the skin from microbial infection.,nih.gov,Real
RHR017,Allergy,Intracameral cefuroxime use in cataract surgery evaluated after penicillin allergy reclassification,JAMA Ophthalmology research examined the safety of intracameral cefuroxime use in cataract surgery following penicillin allergy reclassification.,jamanetwork.com,Real
RHR018,Allergy,Occupational rhinitis and asthma underrecognized in healthcare workers,"Experts call for better recognition of occupational allergic diseases among healthcare professionals exposed to latex, disinfectants and other sensitizers.",jamanetwork.com,Real
RHR019,Dermatology,World Health Assembly passes first-ever resolution on skin diseases,"Adopted in May 2025 by all 194 WHO member states, the resolution marked the first time skin diseases have been formally acknowledged at the global health policy level.",dermatologytimes.com,Real
RHR020,Dermatology,WHO resolution on skin health pushes member states to close care gaps,"The new WHA resolution spotlights skin health as a global public health priority, pushing member states to integrate dermatology into public health.",dermatologytimes.com,Real
RHR021,Dermatology,Genetic cause identified for rare inflammatory skin condition OTULIN-related pyoderma gangrenosum,An international team identified a mutation in the OTULIN gene causes pediatric-onset pyoderma gangrenosum characterized by recurrent ulcerating skin sores.,eurekalert.org,Real
RHR022,Dermatology,ZNF750 gene helps build skin's first line of immune defense,"Mutations in ZNF750 are known to cause rare inherited skin disorders and are linked to psoriasis, a chronic inflammatory disease.",eurekalert.org,Real
RHR023,Dermatology,Brazilian nanotechnology enables precise treatment of psoriasis and vitiligo,Researchers at the University of Săo Paulo developed liquid crystal nanoparticles containing therapeutic molecules that reduce inflammation in skin diseases.,eurekalert.org,Real
RHR024,Dermatology,Gene therapy provides skin replacement for boy with rare junctional epidermolysis bullosa,The boy had a rare incurable skin disease caused by genetic mutations; people with the disease lack critical proteins attaching outer to inner skin layers.,news.cgtn.com,Real
RHR025,Dermatology,Punjabi University and PGIMER develop AI tool for autoimmune blistering disease diagnosis,A joint study developed AI-based methods to aid diagnosis of rare and complex Autoimmune Blistering Diseases (AIBDs).,economictimes.indiatimes.com,Real
RHR026,Dermatology,Shared decision-making and newer nonsteroidal topicals reshape pediatric eczema care,"Peter Lio, MD, explains how shared decision-making and newer nonsteroidal topicals and systemic options are easing steroid worries in pediatric eczema.",dermatologytimes.com,Real
RHR027,Dermatology,Novel treatment approaches for keloids and hypertrophic scars in skin of colour,Keloids and hypertrophic scars are excessive fibrous tissue proliferations from abnormal wound healing; new approaches address treatment in skin of colour.,onlinelibrary.wiley.com,Real
RHR028,Dermatology,Clusters of dermatophilosis reported in five EU/EEA countries in 2025–2026,"Most cases diagnosed between December 2025 and June 2026, presenting with papular, pustular or scaly, pruritic skin lesions mainly in genital and facial areas.",ecdc.europa.eu,Real
RHR029,Dermatology,Emerging transmissible dermatosis cases confirmed in Barcelona,"Ten cases confirmed in Barcelona between December 2025 and April 2026, with two highly probable cases pending confirmation.",medscape.com,Real
RHR030,Dermatology,Animal skin disease confirmed in clusters of European men who have sex with men,Cases of an animal skin disease identified in clusters among European men who have sex with men.,statnews.com,Real
RHR031,Dermatology,FDA accepts Arcutis supplemental New Drug Application for dermatologic condition,The FDA acceptance of Arcutis's supplemental New Drug Application marks progress in dermatologic therapeutics.,hcplive.com,Real
RHR032,Dermatology,Intranasal steroid cream eases post-surgical rhinosinusitis in allergy patients,Research highlights intranasal steroid cream as an effective option for managing post-surgical rhinosinusitis.,hcplive.com,Real
RHR033,Ophthalmology,AI-OCT system reduces unnecessary diabetic eye referrals by nearly two-thirds,"Adding an AI-OCT system to diabetic retinopathy screening reduced false-positive referrals by almost two-thirds, easing pressure on specialist ophthalmology services.",insightnews.com.au,Real
RHR034,Ophthalmology,AI research shows power for improving productivity of eye care teams,"Published in Nature, the peer-reviewed study is the first to demonstrate significant improvements in medical professional productivity using autonomous AI to test for diabetic eye diseases.",orbis.org,Real
RHR035,Ophthalmology,Orbis research shows AI helps eye care professionals see more patients,"AI allows doctors to work smarter and faster, which can be the difference between a life of impaired sight or clear vision in resource-limited settings.",orbis.org,Real
RHR036,Ophthalmology,India's first 3D Flex Aqueous Angiography with iStent performed for glaucoma,"The Army Hospital in Delhi successfully performed the country's first-ever 3D Flex Aqueous Angiography with iStent, combining advanced imaging with minimally invasive glaucoma surgery.",newsonair.gov.in,Real
RHR037,Ophthalmology,Operation DRISHTI conducts India's largest-ever mega eye surgical camp,A specialized ophthalmic team from the Indian Army and Indian Air Force conducted the 9th Mega Surgical Advanced Eye Camp under Operation DRISHTI.,thestatesman.com,Real
RHR038,Ophthalmology,AAPOS launches pilot to detect diabetic retinopathy in government hospitals,"AP launches AI-based pilot to detect diabetic retinopathy in government hospitals, expanding access to vision screening.",newindianexpress.com,Real
RHR039,Ophthalmology,Emerging ophthalmic research presented at AAO and ASOPRS 2025 meetings,Results from two distinct yet complementary studies presented at the meetings highlighted the breadth of modern vision science.,modernretina.com,Real
RHR040,Gastroenterology,Gut hormone discovery could explain up to 40% of IBS-diarrhea cases,"High levels of a hormone found in gut cells could underlie many cases of chronic diarrhea, according to a Cambridge University study.",cambridgebrc.nihr.ac.uk,Real
RHR041,Gastroenterology,Gastrointestinal symptoms in EDS not caused by structural problems as previously assumed,"GI symptoms affect over 50% of EDS patients including nausea, difficulty swallowing, acid reflux, bloating, constipation, diarrhea and chronic abdominal pain.",eurekalert.org,Real
RHR042,Gastroenterology,Virtual team-based GI care superior to traditional care,A virtual multidisciplinary care program for chronic GI disorders significantly improved patient outcomes while reducing healthcare utilization and costs.,medscape.com,Real
RHR043,Gastroenterology,Ultraprocessed foods linked to signs of early-onset colorectal cancer in women,Research highlights the connection between ultraprocessed food consumption and early-onset colorectal cancer signs in women.,jamanetwork.com,Real
RHR044,Gastroenterology,2025 sees shift from therapeutic management to active disease prevention in liver disease,The understanding and management of metabolic dysfunction-associated steatotic liver disease has shifted from pure therapeutics to active prevention.,nature.com,Real
RHR045,Gastroenterology,Rising fall incidence among patients with inflammatory bowel disease,A multiyear analysis from a national real-world dataset examined rising fall incidence among IBD patients.,journals.lww.com,Real
RHR046,Gastroenterology,Bowel symptoms identified as red flag for diverticulitis,World Gastroenterology Organisation highlights bowel symptoms as a potential warning sign for diverticulitis.,worldgastroenterology.org,Real
RHR047,Gastroenterology,Opiate use should be considered before diagnosing esophageal motility disorder,Experts recommend asking about opiate use before diagnosing esophageal motility disorders.,worldgastroenterology.org,Real
RHR048,Gastroenterology,Integrated team-based care beneficial for managing IBS patients,Care that includes dietary and behavioral health is helpful for managing GI patients with irritable bowel syndrome.,medscape.com,Real
RHR049,Oncology,Daraxonrasib nearly doubles survival in advanced pancreatic cancer,A large clinical trial found daraxonrasib nearly doubled survival from 6.7 months to 13.2 months in people with advanced pancreatic cancer.,nature.com,Real
RHR050,Oncology,"ASCO 2026 breakthrough findings for liposarcoma, liver, lung, prostate and blood cancers","Memorial Sloan Kettering experts presented breakthrough findings in liposarcoma, hepatocellular carcinoma, non-small cell lung cancer, prostate cancer and multiple myeloma.",mskcc.org,Real
RHR051,Oncology,Zoldonrasib receives FDA Breakthrough Therapy designation for G12D-mutated lung cancer,The investigational KRAS(ON) inhibitor showed encouraging responses in advanced G12D-mutated NSCLC and received FDA Breakthrough Therapy designation in January 2026.,aacr.org,Real
RHR052,Oncology,FDA approves zenocutuzumab for pancreatic and non-small cell lung cancer with NRG1 fusions,The FDA has approved zenocutuzumab (Bizengri) to treat people with pancreatic or non-small cell lung cancer whose tumors have a rare genetic alteration called an NRG1 fusion.,cancer.gov,Real
RHR053,Oncology,Home-based chemotherapy demonstrates safety and feasibility in pilot study,"Mayo Clinic researchers demonstrated that chemotherapy can be safely delivered in patients' homes, with 93 IV infusions to 10 patients and no treatment-related reactions.",eurekalert.org,Real
RHR054,Oncology,At-home chemotherapy reduces burden while maintaining quality standards,"The model allows safe delivery of high-quality care directly to patients, reducing physical, emotional and financial burdens associated with cancer treatment.",eurekalert.org,Real
RHR055,Oncology,NIH-funded AI model predicts cancer survival from single-cell tumor data,Researchers developed a cancer assessment tool identifying high-risk patients and tumor cells linked to that risk in melanoma and liver cancer.,nih.gov,Real
RHR056,Oncology,Blood tests may detect dozens of cancers but efficacy remains under evaluation,NHS England found first-year Galleri trial results not compelling enough to broaden the study; final evaluation expected in 2026.,jamanetwork.com,Real
RHR057,Oncology,Proposed FY 2026 budget would cut NIH and NCI funding by nearly 40%,ASCO expressed alarm about significant proposed funding cuts to NIH and NCI that would stunt US cancer research if implemented.,asco.org,Real
RHR058,Oncology,US NIH cutting ties with WHO's International Agency for Research on Cancer,"NIH is cutting ties with IARC, WHO's 60-year-old cancer research arm, affecting lymphoma consortium, lung cancer screening and other collaborative efforts.",science.org,Real
RHR059,Oncology,NCI Center for Cancer Research highlights FY25-26 scientific advances,This year's Milestones highlights 14 FY25-26 scientific advances showcasing CCR's unique contributions to the health of the American people.,cancer.gov,Real
RHR060,Oncology,Scripps Research awarded $5 million by NIH to investigate cancer growth,Scientists will investigate how a common dietary nutrient may control a hidden layer of gene regulation in cancer cells.,eurekalert.org,Real
RHR061,Oncology,BeOne Medicines signals solid tumor breakout with three programs nearing Phase 3,The company's solid tumor pipeline has produced five proof-of-concept readouts in roughly two and a half years.,nasdaq.com,Real
RHR062,Oncology,Adding vaccine to pembrolizumab did not improve PFS in advanced melanoma patients,ESMO 2025 trial showed patients with untreated advanced melanoma did not gain a survival advantage from adding a cancer vaccine to pembrolizumab.,medscape.com,Real
RHR063,COVID-19,CDC advisers discuss narrowing COVID-19 booster recommendations for 2025-2026 season,The panel raised the idea of recommending updated vaccine only for vulnerable populations at risk of severe COVID-19.,epinews.emphnet.net,Real
RHR064,COVID-19,CDC pulls COVID-19 vaccine recommendation for healthy children and pregnant women,HHS Secretary Robert F. Kennedy Jr. announced via social media that CDC has pulled its recommendation for routine COVID-19 vaccination among healthy children and pregnant women.,contemporarypediatrics.com,Real
RHR065,COVID-19,"Peak COVID-19 hospitalization rate occurred week ending January 3, 2026","The peak hospitalization rate due to COVID-19 during the 2025-2026 respiratory season was 2.0 hospitalizations per 100,000.",cdc.gov,Real
RHR066,COVID-19,"Too few older, at-risk adults receive antiviral treatment for COVID-19","Antivirals are underutilized in older adults and those with comorbidities despite their increased risk for hospitalization, according to a CDC report.",contagionlive.com,Real
RHR067,COVID-19,"CDC reveals vaccination trends for COVID-19, flu and RSV during 2025-2026 season","The CDC reports current vaccination trends for COVID-19, flu, and RSV, highlighting public adoption rates during the respiratory virus season.",ajmc.com,Real
RHR068,COVID-19,FDA panel considers first-of-its-kind mRNA flu vaccine,"US health advisers are debating a new kind of flu vaccine, the first made with mRNA technology that was key to ending the COVID-19 pandemic.",apnews.com,Real
RHR069,COVID-19,HHS and AAP differ on COVID-19 vaccine recommendations for children,"As the 2025-2026 respiratory season approaches, CDC's ACIP has not met and voted on guidelines for COVID-19 vaccines, creating uncertainty.",drugtopics.com,Real
RHR070,COVID-19,US CDC awarded Pfizer $1.24 billion for mRNA COVID-19 vaccines,Chairman Johnson questioned CDC awarding Pfizer $1.24 billion for mRNA COVID-19 vaccines after FDA officials recommended warning of fatal outcomes.,ronjohnson.senate.gov,Real
RHR071,COVID-19,2025-2026 respiratory disease season outlook evaluation published by CDC,CDC published comprehensive evaluation of the 2025-2026 respiratory disease season outlook.,cdc.gov,Real
RHR072,COVID-19,Professional societies push back against political interference in vaccine policy,"A series of politically driven actions in 2025 has undermined US vaccine access, but professional societies and states are resisting.",contagionlive.com,Real
RHR073,Infectious Disease,WHO warns 11% of drugs in poor countries are counterfeit,About 11% of medicines in developing countries are counterfeit and likely responsible for deaths of tens of thousands of children from malaria and pneumonia.,news.cgtn.com,Real
RHR074,Infectious Disease,WHO launches 2026 appeal for nearly $1 billion for health emergencies,"In 2025, WHO and partners supported 30 million people through its annual emergency appeal; the 2026 appeal seeks nearly $1 billion for 36 emergencies.",epinews.emphnet.net,Real
RHR075,Infectious Disease,WHO reports 12% progress against TB despite funding cuts,The WHO found a 12% improvement in tuberculosis outcomes despite funding constraints.,contagionlive.com,Real
RHR076,Infectious Disease,Thailand strengthens polio prevention through SIAs in border districts,"Two SIA rounds were conducted on 11 December 2025 and 13 January 2026, reaching children through Thai schools, migrant learning centres and temporary shelters.",who.int,Real
RHR077,Infectious Disease,Nepal verified for rubella elimination by WHO South-East Asia Region,"WHO South-East Asia Region reaffirmed commitment to eliminate measles and rubella by 2026, with Nepal achieving rubella elimination verification.",who.int,Real
RHR078,Infectious Disease,CDC wastewater surveillance detects measles days to months before clinical confirmation,Wastewater testing can alert public health officials to measles infections days to months before cases are confirmed by doctors.,apnews.com,Real
RHR079,Infectious Disease,"National wastewater surveillance system covers over 1,300 sites serving 147 million people",CDC's national wastewater surveillance system includes six centers of excellence that innovate and support states in expanding testing.,apnews.com,Real
RHR080,Infectious Disease,Colorado wastewater surveillance detected measles before first positive test,Colorado health officials were able to get ahead of measles by tracking its presence in sewer systems.,apnews.com,Real
RHR081,Infectious Disease,Oregon researchers found wastewater could warn of outbreak more than two months before first case,Wastewater could have warned Oregon of an outbreak more than two months before the first person tested positive.,apnews.com,Real
RHR082,Infectious Disease,"New World screwworm, flesh-eating parasite, detected in southwestern US","Federal health officials are mobilizing against the New World screwworm, a flesh-eating parasite recently detected in animals in the southwest.",infectiousdiseaseadvisor.com,Real
RHR083,Infectious Disease,WHO South-East Asia makes progress toward measles and rubella elimination,The 10th meeting of the Regional Verification Commission announced significant progress toward measles and rubella elimination by 2026.,who.int,Real
RHR084,Public Health,WHO reports 567 million additional people covered by essential health services in 2025,"An estimated 567 million additional people were covered by essential health services in 2025, up 136 million from 2024.",who.int,Real
RHR085,Public Health,WHO reports 698 million more people protected from health emergencies in 2025,"Around 698 million more people were better protected from health emergencies, a rise of 61 million on the previous year.",who.int,Real
RHR086,Public Health,1.75 billion additional people living healthier lives in 2025,"An estimated 1.75 billion additional people living healthier lives in 2025, compared with baseline in 2018 – an increase of 300 million since 2024.",who.int,Real
RHR087,Public Health,"WHO workforce to shrink 22% from 9,401 to 7,360 staff by June 2026","The World Health Organization projects its workforce will shrink from 9,401 staff in January 2025 to 7,360 by June 2026.",swissinfo.ch,Real
RHR088,Public Health,WHO warns funding cuts undermine global health systems,The UN World Health Organization warned that cuts to international aid and persistent funding gaps are undermining the global health system.,epinews.emphnet.net,Real
RHR089,Public Health,Trust in federal health agencies dropped sharply between 2025 and 2026,"Between 2025 and 2026, trust in state public health agencies dropped from 80% to 66%, while trust in local agencies dropped from 82% to 70%.",thehill.com,Real
RHR090,Public Health,Trust in CDC health recommendations fell from 92% to 34% among Democrats,"Between 2025 to 2026, trust in CDC health recommendations fell from 92% to 34% among Democrats, and from 77% to 47% among Independents.",usnews.com,Real
RHR091,Public Health,Nearly half of CDC surveillance databases have halted updates,"As of early December 2025, almost no halted surveillance databases had resumed updating, raising concerns about health data gaps.",eurekalert.org,Real
RHR092,Public Health,Trump FY 2026 budget proposes eliminating CDC chronic disease prevention programs,President Trump's fiscal year 2026 budget proposed eliminating the CDC's chronic disease and injury prevention programs entirely.,yerepouni-news.com,Real
RHR093,Public Health,Trump FY 2026 budget proposes 50% reduction in CDC funding,Trump's FY 2026 budget proposes a 50% reduction in CDC funding from $9.2 billion to $4.3 billion.,jamanetwork.com,Real
RHR094,Public Health,WHO urges cost-effective solutions on NCDs and mental health,An additional investment of just US$3 per person annually in tackling NCDs could yield economic benefits of up to US$1 trillion by 2030.,epinews.emphnet.net,Real
RHR095,Genetics,1 in 8 adults carries hidden genetic risk for serious conditions,"Mayo Clinic researchers sequenced genomes of 484 seemingly healthy adults and found about 13% carried serious, previously unrecognized genomic risks.",eurekalert.org,Real
RHR096,Genetics,"Genetic findings included hereditary breast and ovarian cancer, Lynch syndrome, cardiomyopathy","Actionable findings pointed to hereditary breast and ovarian cancer, Lynch syndrome linked to colorectal cancer, cardiomyopathy, long QT syndrome and amyloidosis.",eurekalert.org,Real
RHR097,Genetics,98.6% of participants had at least one genetic finding requiring monitoring,"Nearly all participants, 98.6%, had at least one genetic finding, and for most, the results called for monitoring.",eurekalert.org,Real
RHR098,Genetics,Most people with familial hypercholesterolemia go undiagnosed,Current genetic screening guidelines fail to identify most people with familial hypercholesterolemia causing dangerously high cholesterol and early heart disease.,eurekalert.org,Real
RHR099,Genetics,Genetic counselors play key role in translating genomic findings into care,"Genetic counselors review results, prepare individualized summaries and help guide next steps for patients and care teams.",eurekalert.org,Real
RHR100,Genetics,Predictive genomic screening presents both clinical opportunity and systems challenge,The study positions predictive genomic screening as both a clinical opportunity and a systems challenge – the science exists but infrastructure lags.,eurekalert.org,Real
RHR101,Cardiology,Mayo Clinic study finds most with familial hypercholesterolemia go undiagnosed,Current genetic screening guidelines fail to identify most people with inherited condition causing dangerously high cholesterol and early heart disease.,eurekalert.org,Real
RHR102,Cardiology,Familial hypercholesterolemia screening gaps put patients at risk for early heart disease,Mayo Clinic study found genetic screening guidelines miss most people with familial hypercholesterolemia.,eurekalert.org,Real
RHR103,Cardiology,Mayo Clinic Proceedings spotlights women's health and hypertension,This month's editorial encompasses articles in Mayo Clinic Proceedings spotlighting aspects of women's health and hypertension.,mayoclinicproceedings.org,Real
RHR104,Cardiology,Social determinants of health and disease featured in Mayo Clinic editorial,This month's editorial encompasses 3 articles spotlighting aspects of social determinants of health and disease.,mayoclinicproceedings.org,Real
RHR105,Cardiology,NIH funding cuts would set back cardiovascular research,Proposed NIH funding cuts threaten cardiovascular research progress and future advances in heart disease care.,asco.org,Real
RHR106,Neurology,Psychological interventions for auditory hallucinations evaluated in systematic review,A systematic review and meta-analysis evaluates psychological and psychosocial interventions for auditory hallucinations in schizophrenia spectrum disorders.,jamanetwork.com,Real
RHR107,Neurology,"Mayo Clinic Precure initiative focuses on Alzheimer's disease, heart failure and chronic liver disease","Precure is Mayo Clinic's enterprise-wide effort to detect disease early, currently focusing on brain, heart, kidneys, liver and lungs.",eurekalert.org,Real
RHR108,Neurology,Precure initiative aims to detect disease before symptoms appear,"Powered by advanced computing and AI, Precure studies conditions such as Alzheimer's disease, heart failure and chronic liver disease.",eurekalert.org,Real
RHR109,Pediatrics,Egg allergy prevalence decreased after guidelines for earlier egg introduction,A cross-sectional study examined whether population prevalence of egg allergy decreased in infants in Australia after updated feeding guidelines.,jamanetwork.com,Real
RHR110,Pediatrics,Emergomycosis without immunodeficiency reported in immunocompetent patient,This case report describes an immunocompetent man in his 50s presenting with a 6-month history of facial ulcers caused by cutaneous emergomycosis.,jamanetwork.com,Real
RHR111,Pediatrics,Immune-mediated inflammatory diseases following pediatric uveitis diagnosis,This cohort study examines the incidence and risk of developing immune-mediated diseases among children and adolescents newly diagnosed with noninfectious uveitis.,jamanetwork.com,Real
RHR112,Pediatrics,Children with eczema nine times more likely to develop allergic asthma,"Children who have eczema, particularly with hay fever, are nine times more likely to develop allergic asthma in their 40s.",news-medical.net,Real
RHR113,Pediatrics,CDC pulls COVID-19 vaccine recommendation for healthy children,"CDC pulled its recommendation for routine COVID-19 vaccination among healthy children, according to HHS Secretary Robert F. Kennedy Jr.",contemporarypediatrics.com,Real
RHR114,Pediatrics,Young eczema sufferers infected with common skin bacterium at higher risk of food allergy,"Young eczema sufferers infected with common skin bacterium are at higher risk of food allergy, new research finds.",news-medical.net,Real
RHR115,Women's Health,HHS and AAP differ on COVID-19 vaccine recommendation for pregnant women,CDC has pulled its recommendation for routine COVID-19 vaccination among pregnant women.,contemporarypediatrics.com,Real
