ID,Disease Domain,News Title,News Snippet,Source Domain,Label
CV480,COVID-19,COVID-19 pandemic led to increased anxiety and fear of infection,Virus-related psychological distress is common globally.,who.int,Real
CV481,COVID-19,COVID-19 infection can cause acute urticarial vasculitis in some patients,Skin lesions with leukocytoclastic vasculitis.,jama.com,Real
CV482,COVID-19,COVID-19 vaccination is safe for patients with history of vaccine allergies,Special precautions may be needed but vaccination recommended.,cdc.gov,Real
CV483,COVID-19,COVID-19 virus can cause intestinal inflammation and cytokine response in the gut,Gut inflammation may contribute to long-COVID symptoms.,nature.com,Real
CV484,COVID-19,COVID-19 pandemic led to increased global cooperation in scientific research,Collaboration accelerated vaccine and treatment development.,who.int,Real
CV485,COVID-19,COVID-19 infection can cause severe monocytopenia and lymphopenia,Immune cell depletion correlates with disease severity.,thelancet.com,Real
CV486,COVID-19,COVID-19 vaccination prevents COVID-19 in public-facing workers like teachers and first responders,Essential workers benefit from high vaccine coverage.,cdc.gov,Real
CV487,COVID-19,COVID-19 virus can cause pulmonary hypertension and right heart strain,Cardiopulmonary complications in severe COVID-19.,nature.com,Real
CV488,COVID-19,COVID-19 pandemic led to increased demand for personal protective equipment (PPE),"Global shortage of masks, gowns, and gloves in 2020.",who.int,Real
CV489,COVID-19,COVID-19 infection can cause severe reactive arthritis in some patients,Post-infectious arthritis mimicking rheumatoid arthritis.,jama.com,Real
CV490,COVID-19,COVID-19 vaccine is recommended for patients with autoimmune hepatitis,Good response and no disease exacerbation reported.,cdc.gov,Real
CV491,COVID-19,"COVID-19 virus can cause severe hypoxemia without dyspnea (""happy hypoxia"")",Silent hypoxia in COVID-19 is a known phenomenon.,nature.com,Real
CV492,COVID-19,COVID-19 pandemic led to increased adoption of digital health records and AI tools,Health systems accelerated technology adoption.,who.int,Real
CV493,COVID-19,COVID-19 infection can cause severe encephalitis and meningoencephalitis,Neurological involvement in severe cases.,neurology.org,Real
CV494,COVID-19,COVID-19 vaccine reduces severe COVID-19 in patients with rare genetic disorders,High-risk groups benefit from vaccination.,cdc.gov,Real
CV495,COVID-19,COVID-19 virus infection can cause severe metabolic acidosis with multiple organ failure,Lactic acidosis and acid-base disturbances in critical illness.,thelancet.com,Real
CV496,COVID-19,COVID-19 pandemic led to increased use of social support and mental health hotlines,Helplines saw 50% increase in call volume.,who.int,Real
CV497,COVID-19,COVID-19 infection can cause severe balanitis in men,Rare complication involving genital inflammation.,jama.com,Real
CV498,COVID-19,COVID-19 vaccine prevents severe disease in patients with chronic kidney disease stage 5,Dialysis-dependent patients show good protection.,cdc.gov,Real
CV499,COVID-19,COVID-19 virus can cause severe SARS-like illness requiring mechanical ventilation,Severe acute respiratory distress syndrome in 15% of patients.,nature.com,Real
CV500,COVID-19,COVID-19 pandemic led to increased recognition of public health importance globally,Pandemic reshaped public health policy and funding priorities.,who.int,Real
MM001,Atopic Dermatitis,"Atopic dermatitis (AD) linked to 33 other diseases, study finds","A comprehensive study using NHANES data identified 33 diseases associated with AD, spanning allergies, mental health disorders, and cancer.",nature.com,Real
MM002,Allergy & Skin,Atopic dermatitis shows strongest correlation with gastroenteritis,Research reveals non-infective gastroenteritis and colitis had the most significant link to AD among 33 associated diseases.,nature.com,Real
MM003,Atopic Dermatitis & Cancer,"AD linked to malignant neoplasms of prostate, breast, and other organs",The NHANES study found a significant association between atopic dermatitis and several malignant tumors.,nature.com,Real
MM004,Allergy & Skin,Atopic dermatitis and allergic diseases are strongly connected,"The study confirmed robust correlations between AD and asthma, allergic rhinitis, and food allergy.",nature.com,Real
MM005,Atopic Dermatitis,Schizophrenia and sleep disorders are associated with atopic dermatitis,"Mental disorders with impairment, including schizophrenia, sleep disorders, and comorbid mental conditions, were linked to AD.",nature.com,Real
MM006,Allergy & Skin,The 'atopic march': from skin to food allergy to asthma,"The progression of allergic diseases often starts with AD in infancy, evolving into food allergies and asthma.",nature.com,Real
MM007,Atopic Dermatitis,Systemic inflammation and itching mark atopic dermatitis,"Characterized by persistent itching, AD is a chronic inflammatory skin disease affecting up to 10% of adults.",nature.com,Real
MM008,Allergy & Skin,Childhood onset of atopic dermatitis leads to lifelong burden,"About 24% of children suffer from AD, which often persists into adulthood and impacts quality of life.",nature.com,Real
MM009,Atopic Dermatitis & Autoimmune,AD associated with increased risk of rheumatoid arthritis and lupus,Meta-analyses show a higher possibility of autoimmune comorbidities in patients with atopic dermatitis.,nature.com,Real
MM010,Atopic Dermatitis,Cardiovascular disease risk elevated in patients with AD,"Studies indicate an increased risk of stroke, hypertension, and myocardial infarction in individuals with atopic dermatitis.",nature.com,Real
MM011,Atopic Dermatitis,Identifying AD-associated diseases can improve health outcomes,Researchers propose that patients with AD and associated conditions should be diagnosed with ADADs for better management.,nature.com,Real
MM012,Allergy & Skin,"Study defines ""AD-associated diseases"" (ADADs) for clinical guidance","The research provides a systematic framework for linking AD to 422 diseases, offering a clinical guideline for diagnosis.",nature.com,Real
MM013,Atopic Dermatitis & Gut,Non-infective gastroenteritis has strongest link to AD (OR: 38.39),Data analysis revealed a remarkably high odds ratio between atopic dermatitis and specific gut inflammation.,nature.com,Real
MM014,Atopic Dermatitis & Mental Health,Depression and anxiety are common comorbidities in AD patients,"The study confirmed that mental disorders, including depression and suicidal ideation, are more prevalent with AD.",nature.com,Real
MM015,Allergy & Skin,"Atopic dermatitis primarily affects children, causing life-long recurrence","The condition's onset in childhood leads to a chronic, relapsing course that affects sleep, work, and relationships.",nature.com,Real
MM016,Atopic Dermatitis & Eye,AD linked to acute atopic conjunctivitis and other inflammatory diseases,Inflammatory diseases like acute atopic conjunctivitis were identified as significantly associated with AD.,nature.com,Real
MM017,Allergy & Skin,Allergic rhinitis and other seasonal allergies linked to AD,"The study found that allergic rhinitis, including other seasonal allergic rhinitis, is associated with atopic dermatitis.",nature.com,Real
MM018,Atopic Dermatitis & Symptoms,"Wheezing, pruritus, and gout are associated with AD","Beyond chronic conditions, the study found links to symptoms like wheezing and pruritus, and diseases like gout.",nature.com,Real
MM019,Atopic Dermatitis & Inflammation,Chronic bronchitis is associated with atopic dermatitis,The study identified unspecified chronic bronchitis as one of the inflammatory diseases linked to AD.,nature.com,Real
MM020,Atopic Dermatitis & Cancer,Primary malignant neoplasms linked to atopic dermatitis,The research suggests a connection between AD and the development of primary malignant tumors.,nature.com,Real
MM021,Atopic Dermatitis & Arthritis,Osteoarthritis linked to atopic dermatitis,The NHANES analysis associated osteoarthritis with AD as an inflammatory disease.,nature.com,Real
MM022,Allergy & Skin,Atopic dermatitis impacts 15-20% of children and 10% of adults globally,The high global prevalence of AD imposes a significant economic burden and reduces the quality of life for patients.,nature.com,Real
MM023,Atopic Dermatitis & Gut,The skin-gut axis plays a role in atopic dermatitis,Immunologic research suggests that the interconnectedness of the skin and gut microbiome influences systemic inflammation and disease.,nature.com,Real
MM024,Atopic Dermatitis,Non-Hispanic Whites and males show higher rates of AD,Demographic analysis from the NHANES data reveals specific population groups with higher AD prevalence.,nature.com,Real
MM025,Allergy & Skin,The burden of atopic dermatitis extends beyond physical symptoms,"Chronic itching and sleep disturbance interfere with occupations, sleeping quality, and intimate relationships.",nature.com,Real
MM026,Atopic Dermatitis,Researchers call for better diagnosis of AD-associated diseases,A systematic guideline for diagnosing ADADs could help in conducting early interventions to improve patient outcomes.,nature.com,Real
MM027,Atopic Dermatitis,Study data reveals key comorbidities in US adults,"The research used data from 17,924 participants from the NHANES (2013-2018) to identify these disease links.",nature.com,Real
MM028,Atopic Dermatitis & Asthma,Allergic asthma is a significant comorbidity of AD,The study confirmed a strong link between asthma and atopic dermatitis in the US population.,nature.com,Real
MM029,Atopic Dermatitis & Food Allergy,"Food allergy is a key part of the ""atopic march"" from AD",The progression from AD to food allergy in infancy is a well-documented evolutionary trajectory of allergic disease.,nature.com,Real
MM030,Atopic Dermatitis,33 diseases are identified as AD-associated diseases (ADADs),The systematic analysis provides a comprehensive list of diseases correlated with atopic dermatitis for clinical use.,nature.com,Real
MM031,Atopic Dermatitis,Atopic dermatitis can predispose patients to other immune disorders,The study suggests that the chronic inflammation of the skin may be a contributing factor to systemic diseases.,nature.com,Real
MM032,Allergy & Skin,"The ""atopic march"" defines disease progression in childhood",Understanding the time-based order of AD to food allergy to asthma is crucial for early prevention.,nature.com,Real
MM033,Atopic Dermatitis & Cancer,Prostate cancer risk is linked to atopic dermatitis,The study found a statistically significant association between AD and malignant neoplasm of the prostate.,nature.com,Real
MM034,Atopic Dermatitis & Cancer,Breast cancer is another malignancy associated with AD,"The research identified malignant neoplasm of the breast as an ADAD, warranting further investigation.",nature.com,Real
MM035,Atopic Dermatitis & Cardiovascular,Ischemic stroke risk is elevated in patients with AD,The study found that patients with atopic dermatitis have an increased risk of cardiovascular diseases like stroke.,nature.com,Real
MM036,Atopic Dermatitis & Mental Health,Suicidal ideation is a comorbidity in AD patients,The psychological burden of chronic skin conditions can lead to severe mental health issues.,nature.com,Real
MM037,Allergy & Skin,Eosinophilic disorders may be linked to AD and gut inflammation,Emerging research suggests that the immune pathways in AD and gut disorders are interconnected.,mayocliniclabs.com,Real
MM038,Atopic Dermatitis,Mast cell activation syndrome may be associated with AD,Research from Mayo Clinic explores the complex role of mast cells in allergic and inflammatory diseases.,mayocliniclabs.com,Real
MM039,Atopic Dermatitis & Immunology,Immunologic mechanisms in AD involve Th2-mediated inflammation,"Key immune pathways in AD, such as Th2 cytokines, are being studied to develop targeted therapies.",nih.gov,Real
MM040,Atopic Dermatitis & Allergy,AD patients are more likely to have elevated specific IgE antibodies,Allergy testing for AD often involves measuring IgE antibodies to identify triggers.,mayocliniclabs.com,Real
MM041,Atopic Dermatitis & Gut,The skin-gut axis is a new frontier in immunology research,The interconnectedness of skin and gut microbiomes is a key area of research for systemic inflammatory diseases.,nih.gov,Real
MM042,Allergy & Skin,Atopic conjunctivitis is a common complication of AD,Patients with AD often experience eye-related allergic symptoms like conjunctivitis.,nature.com,Real
MM043,Atopic Dermatitis & Respiratory,Unspecified chronic bronchitis is linked to AD,Inflammatory conditions of the airways are a common comorbidity with chronic skin inflammation.,nature.com,Real
MM044,Atopic Dermatitis,Pruritus is the defining symptom of atopic dermatitis,"The intense, chronic itching of AD can severely affect patient quality of life and sleep.",nature.com,Real
MM045,Allergy & Skin,AD patients often experience a reduced quality of life,The economic burden and physical-mental impact make AD a significant public health issue.,nature.com,Real
MM046,Atopic Dermatitis & Gut,Non-infective gastroenteritis and colitis have the strongest AD association,"The study showed an OR of 38.39 for this association, highlighting a major gut-skin link.",nature.com,Real
MM047,Atopic Dermatitis & Cancer,Malignant neoplasm is a significant comorbidity of AD,"Beyond skin cancer, the study linked AD to internal (primary) malignant neoplasms.",nature.com,Real
MM048,Atopic Dermatitis & Mental Health,Sleep disorders are prevalent in AD patients,"Chronic itching often leads to sleep deprivation, contributing to the disease's systemic burden.",nature.com,Real
MM049,Atopic Dermatitis,The systemic effects of AD extend beyond the skin,The inflammation in AD is not limited to the skin but can have widespread effects on the body.,nature.com,Real
MM050,Allergy & Skin,Understanding the atopic march helps predict disease trajectory,Recognizing the progression from AD to allergies helps clinicians anticipate and treat future conditions.,nature.com,Real
MM051,Allergy & Gut,Allergic diseases are linked to gastrointestinal inflammation,The study found that noninfective gastroenteritis and colitis are strongly associated with allergic conditions.,nature.com,Real
MM052,Ophthalmology,Atopic conjunctivitis is a disease associated with AD and allergies,Acute atopic conjunctivitis is identified as an inflammatory eye disease linked to atopic dermatitis.,nature.com,Real
MM053,Allergy & Skin,Seasonal allergic rhinitis is a key allergy associated with AD,Patients with AD are more likely to suffer from seasonal allergies due to a shared immune pathway.,nature.com,Real
MM054,Oncology,Atopic dermatitis patients have higher rates of prostate cancer,The research suggests a link between chronic systemic inflammation in AD and prostate malignancy risk.,nature.com,Real
MM055,Oncology,Breast cancer risk is associated with atopic dermatitis,"The study found a significant correlation between breast cancer and AD, contributing to the field of immuno-oncology.",nature.com,Real
MM056,Gastroenterology,Ulcerative colitis may be linked to the skin-gut axis,Research on AD and gut inflammation is shedding light on the relationship between IBD and skin conditions.,nature.com,Real
MM057,Allergy & Respiratory,The atopic march: from AD to asthma in children,The progression of allergic diseases from the skin to the respiratory tract is well-documented in children.,nature.com,Real
MM058,Allergy & Skin,Food allergy often follows atopic dermatitis in infancy,"The ""atopic march"" begins with eczema in infants and can evolve into food allergies.",nature.com,Real
MM059,Atopic Dermatitis,OA (Osteoarthritis) is linked to AD,The study identified osteoarthritis as an AD-associated inflammatory disease.,nature.com,Real
MM060,Atopic Dermatitis & Gout,Gout is a significant comorbidity of atopic dermatitis,"The study found a link between AD and gout, a type of inflammatory arthritis.",nature.com,Real
MM061,Allergy,Allergic diseases affect over 50 million Americans,Data from the NHANES study reveals the high prevalence of allergic diseases in the US.,nih.gov,Real
MM062,Gastroenterology,Non-infective gastroenteritis can indicate systemic inflammation,The strong link between gastroenteritis and AD suggests shared inflammatory pathways.,nature.com,Real
MM063,Ophthalmology,Patients with allergies often suffer from eye diseases,Acute atopic conjunctivitis and other eye conditions are common in allergic patients.,nature.com,Real
MM064,Oncology,The link between inflammation and cancer is a key research area,Chronic inflammatory conditions like AD can increase the risk of certain cancers.,nature.com,Real
MM065,Allergy & Skin,Allergic rhinitis is more common in patients with AD,The study shows a clear association between allergic rhinitis and atopic dermatitis.,nature.com,Real
MM066,Oncology,Malignant neoplasm (primary) is an AD-associated disease,The research suggests that systemic inflammation in AD may increase the risk of developing primary tumors.,nature.com,Real
MM067,Gastroenterology,The skin-gut axis is a key player in immune disease,Research on the gut microbiome and its effects on skin health is rapidly evolving.,nih.gov,Real
MM068,Allergy & Skin,Eczema (AD) is a risk factor for developing asthma,"The ""atopic march"" highlights how early childhood eczema can lead to asthma later in life.",nature.com,Real
MM069,Atopic Dermatitis,Sleep disorders in AD patients can lead to mental health issues,The chronic itch and sleep deprivation associated with AD can exacerbate depression and anxiety.,nature.com,Real
MM070,Allergy & Skin,Mast cell activation syndrome and allergies are intertwined,Mayo Clinic research focuses on mast cell disorders and their impact on allergic reactions and inflammation.,mayocliniclabs.com,Real
MM071,Ophthalmology,Acute atopic conjunctivitis is a classic comorbidity of allergic disease,The condition is an inflammation of the eye linked to allergic reactions and AD.,nature.com,Real
MM072,Gastroenterology,Chronic colitis is linked to systemic allergic responses,"The study identified colitis as a disease associated with AD, highlighting a gut-skin connection.",nature.com,Real
MM073,Oncology,Atopic dermatitis is associated with a higher risk of cancer,The study found that patients with AD are at a higher risk for specific malignant neoplasms.,nature.com,Real
MM074,Allergy & Respiratory,Allergic asthma is a common comorbidity of atopic dermatitis,The study found a significant association between asthma and AD.,nature.com,Real
MM075,Allergy,Specific IgE testing is used to diagnose allergies,Mayo Clinic offers a wide array of specific IgE tests to measure allergy-causing antibodies.,mayocliniclabs.com,Real
MM076,Atopic Dermatitis,The genetic basis of AD is linked to immune dysregulation,Research suggests that the immune system's response to the environment plays a key role in AD.,nature.com,Real
MM077,Allergy & Gut,Eosinophilic disorders may be linked to the skin-gut axis,Mayo Clinic research explores the relationship between eosinophilic conditions in the gut and allergies.,mayocliniclabs.com,Real
MM078,Atopic Dermatitis,Comorbid mental disorders include anxiety and depression,"The study specifically found that ""mental disorders with impairment"" are linked to AD.",nature.com,Real
MM079,Atopic Dermatitis & Gout,Gout is an inflammatory condition linked to AD,The association between gout and AD is a new finding from the NHANES study.,nature.com,Real
MM080,Allergy & Skin,The atopic march can be prevented by early intervention,Understanding the disease progression may allow for early treatments to stop the atopic march.,nature.com,Real
MM081,Gastroenterology,Irritable bowel syndrome (IBS) may share immune pathways with AD,Inflammatory bowel disease testing is crucial for diagnosing conditions linked to systemic inflammation.,mayocliniclabs.com,Real
MM082,Ophthalmology,Eye inflammation is a common symptom of allergic diseases,"Eye redness, itching, and pain can indicate allergic conjunctivitis.",nature.com,Real
MM083,Oncology,Prostate and breast cancer are under the immuno-oncology umbrella,The link between AD and these cancers suggests a role for the immune system in tumor development.,nature.com,Real
MM084,Allergy & Skin,Allergic reactions are mediated by the immune system,Understanding IgE antibodies is key to diagnosing and managing allergic diseases.,mayocliniclabs.com,Real
MM085,Atopic Dermatitis,The prevalence of AD is increasing in urbanized countries,"Incidence rates are on the rise, making AD a global health concern.",nature.com,Real
MM086,Gastroenterology,Non-infective gastroenteritis has the highest odds ratio with AD,This finding emphasizes the importance of the gut-skin axis in clinical research.,nature.com,Real
MM087,Atopic Dermatitis,Inflammatory disease burden is high in AD patients,"The study identified many inflammatory diseases, including arthritis, linked to AD.",nature.com,Real
MM088,Allergy,Allergen testing is used to identify triggers in AD and allergies,Mayo Clinic offers ImmunoCAP and other tests to detect allergy-causing antibodies.,mayocliniclabs.com,Real
MM089,Atopic Dermatitis,The study uses NHANES data for a comprehensive look at comorbidities,Analyzing a large national database allows for robust correlations between diseases.,nature.com,Real
MM090,Atopic Dermatitis & Cancer,Systemic inflammation from AD may promote cancer development,The chronic inflammatory state of AD is a potential risk factor for certain cancers.,nature.com,Real
MM091,Allergy & Skin,The burden of AD includes work and relationship impact,The physical and mental toll of AD can affect all aspects of a patient's life.,nature.com,Real
MM092,Ophthalmology,Atopic conjunctivitis can be a recurring problem for patients,Eye inflammation associated with allergies can be a chronic condition.,nature.com,Real
MM093,Oncology,ADADs include both primary and secondary malignant neoplasms,The research covers a broad spectrum of cancer types linked to AD.,nature.com,Real
MM094,Allergy & Respiratory,Asthma is a classic disease in the 'atopic march',The progression from eczema to asthma is a common trajectory for pediatric patients.,nature.com,Real
MM095,Gastroenterology,Calprotectin testing is used for IBD diagnosis,Mayo Clinic offers testing for inflammatory bowel disease to distinguish it from irritable bowel syndrome.,mayocliniclabs.com,Real
MM096,Atopic Dermatitis,Pruritus is a debilitating symptom of AD,Itching is the primary symptom that drives the disease's impact on quality of life.,nature.com,Real
MM097,Allergy & Skin,The 'atopic march' concept guides treatment strategies,"Recognizing the link between AD, allergies, and asthma helps in comprehensive patient care.",nature.com,Real
MM098,Atopic Dermatitis,Schizophrenia is a mental disorder linked to AD,The research identified a significant link between severe mental illness and atopic dermatitis.,nature.com,Real
MM099,Allergy & Gut,Food allergies often start with skin inflammation,The atopic march suggests that skin inflammation is the first step in developing food allergies.,nature.com,Real
MM100,Atopic Dermatitis,Cardiovascular health should be monitored in AD patients,The study's link between AD and stroke highlights the need for systemic health monitoring.,nature.com,Real
MM101,Allergy & Skin,Allergic diseases are a major focus at Mayo Clinic Children's Center,The center provides comprehensive care for allergic diseases and asthma in pediatric patients.,mayoclinic.org,Real
MM102,Immunology,Mayo Clinic Labs advances mast cell activation syndrome testing,"A new test panel aids in the diagnosis of mast cell activation syndrome, a complex immunologic disorder.",mayocliniclabs.com,Real
MM103,Allergy & Skin,Specific IgE blood testing helps diagnose allergies,"The test, commonly known as RAST or ImmunoCAP, measures antibodies causing allergic reactions.",mayocliniclabs.com,Real
MM104,Dermatology,Dermatology genetics clinic investigates inherited skin diseases,Mayo Clinic offers specialized genetics clinics for rare skin disorders and atopic dermatitis.,mayoclinic.org,Real
MM105,Allergy & Immunology,Researchers are pushing boundaries on immunologic syndromes,Mayo Clinic experts are studying mast cell activation syndrome and eosinophilic disorders.,mayocliniclabs.com,Real
MM106,Dermatology,Phototherapy can be an effective treatment for eczema,Light therapy helps manage the chronic inflammation of atopic dermatitis.,webmd.com,Real
MM107,Allergy & Skin,Allergen avoidance is a key management strategy for AD,Avoiding triggers identified through allergy testing can help reduce AD flares.,mayocliniclabs.com,Real
MM108,Immunology,The collaboration between Mayo Clinic labs and practice improves testing,"Physician-led research drives the development of advanced, patient-focused immunologic testing.",mayocliniclabs.com,Real
MM109,Allergy & Skin,Food allergy testing is essential for patients with AD,Identifying and removing food allergens can be a key step in managing eczema.,webmd.com,Real
MM110,Immunology,Hereditary immunodeficiencies can be identified with genetic testing,Testing for inborn errors of immunity can clarify prognosis and guide treatment for rare conditions.,mayocliniclabs.com,Real
MM111,Allergy & Respiratory,Pediatric asthma clinic offers comprehensive care at Mayo Clinic,"The clinic provides diagnosis and treatment for asthma, a common allergic disease.",mayoclinic.org,Real
MM112,Allergy,Allergen immunotherapy can reduce allergy symptoms,Allergy shots or sublingual drops help desensitize the immune system to allergens.,mayoclinic.org,Real
MM113,Immunology,Eosinophilic disorders are a focus of novel research,These rare conditions involve elevated eosinophils and can affect multiple organ systems.,mayocliniclabs.com,Real
